{
  "changed": true,
  "changed_dependencies": [
    "resource://policies/method_policy#/allowed_methods"
  ],
  "computed_status": "review_required",
  "dependencies": [
    {
      "baseline": null,
      "changed": true,
      "comparator": "set",
      "current": [
        "method_a",
        "method_b"
      ],
      "current_source_kind": "raw",
      "current_version": "9cc97ae5dc70a3abe20ca11caf0f1e6848bd7a57811f9548b665c93fcf1ab3f5",
      "diff": null,
      "reason": "initial_dependency",
      "source": "resource://policies/method_policy#/allowed_methods"
    }
  ],
  "history": [],
  "prior_receipt": null,
  "reason_codes": [
    "initial_dependency",
    "initial_validation_required"
  ],
  "review_context_id": "reviewctx-008f864d3adaca3950df4d93a23d6f5822b9ea1593ba71683a203101e3ad35dd",
  "rule": {
    "dependencies": [
      {
        "comparator": "set",
        "source": "resource://policies/method_policy#/allowed_methods"
      }
    ],
    "dependency_type": "semantic_review",
    "revision": "sha256:22bdf65003620c83f65971aaa950504dd4e4daffde646204e5ddbceeb1ce58c9",
    "rule_id": "architecture.rationale-method-policy",
    "target": "file://architecture/rationale.md"
  },
  "semantic_judgment": null,
  "state": null,
  "target": "file://architecture/rationale.md",
  "target_current": {
    "content": "# Architecture Rationale\n\nPlain Markdown example that may have a whole-file or semantic dependency without its own JSON.\n",
    "ref": "file://architecture/rationale.md",
    "revision": "c90a6d459b920ddee94544dad323bc2de30ec321d812239bf083c4063db75c36",
    "source_kind": "file"
  }
}
